{
 "refId": "valve-testing",
 "version": "1.0.0",
 "source": "API Standard 598, Valve Inspection and Testing, Tenth Edition, 2023. Tables 1 through 5. Transcribed from a purchased copy held outside version control.",
 "note": "The first reference pack that produces ITP rows rather than drawing figures. B16.34 rates the valve and B16.10 measures it; API 598 says what has to be witnessed before anyone accepts it.",
 "units": {
  "pressure": "barG",
  "alternatePressure": "psig",
  "duration": "seconds"
 },
 "conventions": {
  "shellPressureIsComputedNotTabulated": "For steel and nonferrous valves Table 2 gives no number. It gives a rule: 1.5 x the pressure rating at 38 C, rounded up to the next whole bar. The rating comes from ASME B16.34, so this pack and valve-pt-ratings have to be read together or the answer cannot be produced at all.",
  "twoAxesTheRepoDidNotHave": "API 598 tests a FLOATING ball valve differently from a TRUNNION MOUNTED one, and an API 609 Category A butterfly differently from a Category B. Neither distinction exists on a PMS row today. The pack records the variant on every requirement so a consumer can refuse to answer for a bare \"BALL\" rather than quietly picking one.",
  "highAndLowInvert": "Read Table 1 as a pair. Wherever the low-pressure closure test becomes optional - above Class 1500 for small valves, above Class 600 for large ones - the high-pressure closure test becomes required. The two rows are the same decision written twice.",
  "classThresholdMovesWithSize": "The class band that splits the closure rows is NOT the same for both sizes: 1500 for DN <= 100 and 600 for DN > 100. Treating it as one threshold mis-states every large valve between Class 600 and 1500.",
  "leakageIsByNominalSize": "API 598 5.9.2.6: leakage rates are based on the DN (NPS) of the valve regardless of whether it is full or reduced bore."
 },
 "standard": {
  "code": "API 598",
  "editionYear": 2023,
  "edition": "Tenth",
  "title": "Valve Inspection and Testing",
  "tests": [
   "SHELL",
   "BACKSEAT",
   "LOW_PRESSURE_CLOSURE",
   "HIGH_PRESSURE_CLOSURE",
   "HIGH_PRESSURE_PNEUMATIC_SHELL"
  ],
  "sourceTables": [
   "Table 1",
   "Table 2",
   "Table 3",
   "Table 4",
   "Table 5"
  ]
 },
 "columns": {
  "GATE": {
   "valveType": "GATE",
   "variant": null
  },
  "GLOBE": {
   "valveType": "GLOBE",
   "variant": null,
   "alsoCovers": [
    {
     "valveType": "GATE",
     "variant": "PARALLEL_SLIDE"
    }
   ]
  },
  "PLUG": {
   "valveType": "PLUG",
   "variant": null
  },
  "BFLY_A_CHECK": {
   "valveType": "BUTTERFLY",
   "variant": "CATEGORY_A",
   "alsoCovers": [
    {
     "valveType": "CHECK",
     "variant": null
    }
   ]
  },
  "BALL_FLOATING": {
   "valveType": "BALL",
   "variant": "FLOATING"
  },
  "BFLY_B_TRUNNION": {
   "valveType": "BUTTERFLY",
   "variant": "CATEGORY_B",
   "alsoCovers": [
    {
     "valveType": "BALL",
     "variant": "TRUNNION_MOUNTED"
    }
   ]
  }
 },
 "requirements": [
  {
   "test": "SHELL",
   "column": "GATE",
   "sizeBand": {
    "maxDn": null,
    "minDnExclusive": null,
    "label": "All"
   },
   "classBand": {
    "maxClass": null,
    "minClassExclusive": null,
    "label": "All"
   },
   "requirement": "REQUIRED",
   "noteRefs": []
  },
  {
   "test": "SHELL",
   "column": "GLOBE",
   "sizeBand": {
    "maxDn": null,
    "minDnExclusive": null,
    "label": "All"
   },
   "classBand": {
    "maxClass": null,
    "minClassExclusive": null,
    "label": "All"
   },
   "requirement": "REQUIRED",
   "noteRefs": []
  },
  {
   "test": "SHELL",
   "column": "PLUG",
   "sizeBand": {
    "maxDn": null,
    "minDnExclusive": null,
    "label": "All"
   },
   "classBand": {
    "maxClass": null,
    "minClassExclusive": null,
    "label": "All"
   },
   "requirement": "REQUIRED",
   "noteRefs": []
  },
  {
   "test": "SHELL",
   "column": "BFLY_A_CHECK",
   "sizeBand": {
    "maxDn": null,
    "minDnExclusive": null,
    "label": "All"
   },
   "classBand": {
    "maxClass": null,
    "minClassExclusive": null,
    "label": "All"
   },
   "requirement": "REQUIRED",
   "noteRefs": []
  },
  {
   "test": "SHELL",
   "column": "BALL_FLOATING",
   "sizeBand": {
    "maxDn": null,
    "minDnExclusive": null,
    "label": "All"
   },
   "classBand": {
    "maxClass": null,
    "minClassExclusive": null,
    "label": "All"
   },
   "requirement": "REQUIRED",
   "noteRefs": []
  },
  {
   "test": "SHELL",
   "column": "BFLY_B_TRUNNION",
   "sizeBand": {
    "maxDn": null,
    "minDnExclusive": null,
    "label": "All"
   },
   "classBand": {
    "maxClass": null,
    "minClassExclusive": null,
    "label": "All"
   },
   "requirement": "REQUIRED",
   "noteRefs": []
  },
  {
   "test": "BACKSEAT",
   "column": "GATE",
   "sizeBand": {
    "maxDn": null,
    "minDnExclusive": null,
    "label": "All"
   },
   "classBand": {
    "maxClass": null,
    "minClassExclusive": null,
    "label": "All"
   },
   "requirement": "REQUIRED",
   "noteRefs": [
    "a"
   ]
  },
  {
   "test": "BACKSEAT",
   "column": "GLOBE",
   "sizeBand": {
    "maxDn": null,
    "minDnExclusive": null,
    "label": "All"
   },
   "classBand": {
    "maxClass": null,
    "minClassExclusive": null,
    "label": "All"
   },
   "requirement": "REQUIRED",
   "noteRefs": [
    "a"
   ]
  },
  {
   "test": "BACKSEAT",
   "column": "PLUG",
   "sizeBand": {
    "maxDn": null,
    "minDnExclusive": null,
    "label": "All"
   },
   "classBand": {
    "maxClass": null,
    "minClassExclusive": null,
    "label": "All"
   },
   "requirement": "NOT_APPLICABLE",
   "noteRefs": []
  },
  {
   "test": "BACKSEAT",
   "column": "BFLY_A_CHECK",
   "sizeBand": {
    "maxDn": null,
    "minDnExclusive": null,
    "label": "All"
   },
   "classBand": {
    "maxClass": null,
    "minClassExclusive": null,
    "label": "All"
   },
   "requirement": "NOT_APPLICABLE",
   "noteRefs": []
  },
  {
   "test": "BACKSEAT",
   "column": "BALL_FLOATING",
   "sizeBand": {
    "maxDn": null,
    "minDnExclusive": null,
    "label": "All"
   },
   "classBand": {
    "maxClass": null,
    "minClassExclusive": null,
    "label": "All"
   },
   "requirement": "NOT_APPLICABLE",
   "noteRefs": []
  },
  {
   "test": "BACKSEAT",
   "column": "BFLY_B_TRUNNION",
   "sizeBand": {
    "maxDn": null,
    "minDnExclusive": null,
    "label": "All"
   },
   "classBand": {
    "maxClass": null,
    "minClassExclusive": null,
    "label": "All"
   },
   "requirement": "NOT_APPLICABLE",
   "noteRefs": []
  },
  {
   "test": "LOW_PRESSURE_CLOSURE",
   "column": "GATE",
   "sizeBand": {
    "maxDn": 100,
    "minDnExclusive": null,
    "label": "DN <= 100 (NPS 4)"
   },
   "classBand": {
    "maxClass": 1500,
    "minClassExclusive": null,
    "label": "Class <= 1500"
   },
   "requirement": "REQUIRED",
   "noteRefs": []
  },
  {
   "test": "LOW_PRESSURE_CLOSURE",
   "column": "PLUG",
   "sizeBand": {
    "maxDn": 100,
    "minDnExclusive": null,
    "label": "DN <= 100 (NPS 4)"
   },
   "classBand": {
    "maxClass": 1500,
    "minClassExclusive": null,
    "label": "Class <= 1500"
   },
   "requirement": "REQUIRED",
   "noteRefs": [
    "f"
   ]
  },
  {
   "test": "LOW_PRESSURE_CLOSURE",
   "column": "BFLY_B_TRUNNION",
   "sizeBand": {
    "maxDn": 100,
    "minDnExclusive": null,
    "label": "DN <= 100 (NPS 4)"
   },
   "classBand": {
    "maxClass": 1500,
    "minClassExclusive": null,
    "label": "Class <= 1500"
   },
   "requirement": "REQUIRED",
   "noteRefs": []
  },
  {
   "test": "LOW_PRESSURE_CLOSURE",
   "column": "GLOBE",
   "sizeBand": {
    "maxDn": 100,
    "minDnExclusive": null,
    "label": "DN <= 100 (NPS 4)"
   },
   "classBand": {
    "maxClass": 1500,
    "minClassExclusive": null,
    "label": "Class <= 1500"
   },
   "requirement": "OPTIONAL",
   "noteRefs": [
    "b"
   ]
  },
  {
   "test": "LOW_PRESSURE_CLOSURE",
   "column": "BFLY_A_CHECK",
   "sizeBand": {
    "maxDn": 100,
    "minDnExclusive": null,
    "label": "DN <= 100 (NPS 4)"
   },
   "classBand": {
    "maxClass": 1500,
    "minClassExclusive": null,
    "label": "Class <= 1500"
   },
   "requirement": "OPTIONAL",
   "noteRefs": [
    "b"
   ]
  },
  {
   "test": "LOW_PRESSURE_CLOSURE",
   "column": "BALL_FLOATING",
   "sizeBand": {
    "maxDn": 100,
    "minDnExclusive": null,
    "label": "DN <= 100 (NPS 4)"
   },
   "classBand": {
    "maxClass": 1500,
    "minClassExclusive": null,
    "label": "Class <= 1500"
   },
   "requirement": "REQUIRED",
   "noteRefs": []
  },
  {
   "test": "LOW_PRESSURE_CLOSURE",
   "column": "GATE",
   "sizeBand": {
    "maxDn": 100,
    "minDnExclusive": null,
    "label": "DN <= 100 (NPS 4)"
   },
   "classBand": {
    "maxClass": null,
    "minClassExclusive": 1500,
    "label": "Class > 1500"
   },
   "requirement": "OPTIONAL",
   "noteRefs": [
    "b"
   ]
  },
  {
   "test": "LOW_PRESSURE_CLOSURE",
   "column": "PLUG",
   "sizeBand": {
    "maxDn": 100,
    "minDnExclusive": null,
    "label": "DN <= 100 (NPS 4)"
   },
   "classBand": {
    "maxClass": null,
    "minClassExclusive": 1500,
    "label": "Class > 1500"
   },
   "requirement": "OPTIONAL",
   "noteRefs": [
    "b"
   ]
  },
  {
   "test": "LOW_PRESSURE_CLOSURE",
   "column": "BFLY_B_TRUNNION",
   "sizeBand": {
    "maxDn": 100,
    "minDnExclusive": null,
    "label": "DN <= 100 (NPS 4)"
   },
   "classBand": {
    "maxClass": null,
    "minClassExclusive": 1500,
    "label": "Class > 1500"
   },
   "requirement": "OPTIONAL",
   "noteRefs": [
    "b"
   ]
  },
  {
   "test": "LOW_PRESSURE_CLOSURE",
   "column": "GLOBE",
   "sizeBand": {
    "maxDn": 100,
    "minDnExclusive": null,
    "label": "DN <= 100 (NPS 4)"
   },
   "classBand": {
    "maxClass": null,
    "minClassExclusive": 1500,
    "label": "Class > 1500"
   },
   "requirement": "OPTIONAL",
   "noteRefs": [
    "b"
   ]
  },
  {
   "test": "LOW_PRESSURE_CLOSURE",
   "column": "BFLY_A_CHECK",
   "sizeBand": {
    "maxDn": 100,
    "minDnExclusive": null,
    "label": "DN <= 100 (NPS 4)"
   },